{
  "schema_version": 1,
  "week_id": "2026-W40",
  "date_range_ko": "2026-09-28 ~ 2026-10-04",
  "month_folder": "2026.09",
  "collected_at": "2026-09-30T20:00:09+09:00",
  "source": "huggingface daily_papers?sort=trending&limit=6",
  "paper_count": 6,
  "papers": [
    {
      "id": "2412.20138",
      "title": "TradingAgents: Multi-Agents LLM Financial Trading Framework",
      "title_ko": "TradingAgents: 멀티에이전트 LLM 금융 트레이딩 프레임워크",
      "authors": [
        "Yijia Xiao",
        "Edward Sun",
        "Di Luo",
        "Wei Wang"
      ],
      "published_at": "2024-12-28T07:54:06.000Z",
      "rank": 1,
      "raw": {
        "summary": "Significant progress has been made in automated problem-solving using\nsocieties of agents powered by large language models (LLMs). In finance,\nefforts have largely focused on single-agent systems handling specific tasks or\nmulti-agent frameworks independently gathering data. However, the multi-agent\nsystems' potential to replicate real-world trading firms' collaborative\ndynamics remains underexplored. TradingAgents proposes a novel stock trading\nframework inspired by trading firms, featuring LLM-powered agents in\nspecialized roles such as fundamental analysts, sentiment analysts, technical\nanalysts, and traders with varied risk profiles. The framework includes Bull\nand Bear researcher agents assessing market conditions, a risk management team\nmonitoring exposure, and traders synthesizing insights from debates and\nhistorical data to make informed decisions. By simulating a dynamic,\ncollaborative trading environment, this framework aims to improve trading\nperformance. Detailed architecture and extensive experiments reveal its\nsuperiority over baseline models, with notable improvements in cumulative\nreturns, Sharpe ratio, and maximum drawdown, highlighting the potential of\nmulti-agent LLM frameworks in financial trading. TradingAgents is available at\nhttps://github.com/TauricResearch/TradingAgents.",
        "ai_summary": "A multi-agent framework using large language models for stock trading simulates real-world trading firms, improving performance metrics like cumulative returns and Sharpe ratio.",
        "ai_keywords": [
          "large language models",
          "LLM",
          "multi-agent systems",
          "fundamental analysts",
          "sentiment analysts",
          "technical analysts",
          "traders",
          "risk management",
          "cumulative returns",
          "Sharpe ratio",
          "maximum drawdown"
        ],
        "upvotes": 148,
        "num_comments": 6,
        "github_repo": "https://github.com/tauricresearch/tradingagents",
        "github_stars": 109269,
        "project_page": null
      },
      "links": [
        {
          "rank": 1,
          "label": "HF 토론·요약",
          "url": "https://huggingface.co/papers/2412.20138"
        },
        {
          "rank": 2,
          "label": "arXiv 초록",
          "url": "https://arxiv.org/abs/2412.20138"
        },
        {
          "rank": 3,
          "label": "PDF 원문",
          "url": "https://arxiv.org/pdf/2412.20138"
        },
        {
          "rank": 4,
          "label": "코드(GitHub)",
          "url": "https://github.com/tauricresearch/tradingagents"
        }
      ],
      "classify": {
        "categories": [
          "LLM/Agents"
        ],
        "primary_category": "LLM/Agents",
        "topic_tags": [
          "agentic-workflow",
          "multi-agent",
          "financial-ai",
          "tool-use"
        ],
        "method_tags": [
          "prompting",
          "architecture"
        ],
        "modality": [
          "text"
        ],
        "confidence": "high"
      },
      "tier1": {
        "one_liner": "실제 트레이딩 회사처럼 역할을 나눈 LLM 에이전트들이 토론으로 주식 매매를 결정한다.",
        "problem": "금융 분야의 LLM 활용은 단일 에이전트가 한 가지 작업을 처리하거나 여러 에이전트가 자료를 따로 모으는 수준에 머무는 경우가 많다. 실제 트레이딩 조직처럼 서로 다른 관점이 충돌하고 위험을 통제하는 협업 구조는 충분히 탐구되지 않았다.",
        "approach": "펀더멘털·감성·기술 분석가와 강세(Bull)·약세(Bear) 리서처, 리스크 관리자, 트레이더를 각각 LLM 에이전트로 구현한다. 강세와 약세 에이전트가 시장 상황을 토론하고, 트레이더가 그 논쟁과 과거 데이터를 종합해 행동을 선택한다. 별도의 리스크 관리 팀이 노출 수준을 점검해 공격적·중립적·보수적 관점을 의사결정에 반영한다.",
        "contributions": [
          "실제 트레이딩 회사의 역할 분담과 토론 구조를 재현한 멀티에이전트 프레임워크",
          "베이스라인보다 높은 누적 수익률과 Sharpe Ratio를 보고",
          "Maximum Drawdown까지 함께 평가해 수익뿐 아니라 위험 조정 성과를 비교",
          "코드 공개, GitHub 약 10.9만 스타로 W38(약 10.5만) 이후에도 관심 증가"
        ],
        "why_now": "수집된 14개 주차 중 W32를 뺀 13개 주차에 등장한 최장수 논문으로, 이번에도 트렌딩 순서 1위다(▲133 -> 148). W39를 수집하지 않아 연속 여부는 판정하지 않지만, 관측 공백을 두 번 건너서도 매번 돌아온다는 점에서 금융 멀티에이전트의 구현 참고점이라는 지위는 이제 '화제'가 아니라 '상수'에 가깝다.",
        "difficulty": "중급",
        "recommended_reader": "LLM 에이전트 오케스트레이션과 금융 AI의 구조·평가에 관심 있는 학습자",
        "field_tags": [
          "멀티에이전트",
          "금융AI",
          "에이전트토론",
          "리스크관리"
        ],
        "interest": {
          "upvotes": 148,
          "num_comments": 6,
          "github_stars": 109269
        }
      },
      "tier2": {
        "method_detail": "TradingAgents는 실제 트레이딩 회사를 모사한 LLM 멀티에이전트 프레임워크로, 7개 역할을 5개 팀으로 조직한다. (1) 애널리스트 팀(Analyst Team)은 펀더멘털(fundamental)·감성(sentiment)·뉴스(news)·기술적(technical) 분석가가 각자 구조화 리포트를 생성한다. (2) 리서처 팀(Researcher Team)은 강세(bull)/약세(bear) 연구자가 자연어 토론(natural language debate)을 n라운드 진행하고, 진행자(facilitator) 에이전트가 토론 이력을 검토해 우세 관점을 선택·기록한다(원문 표현 'facilitator ... selects the prevailing perspective'). (3) 트레이더(Trader)가 이를 종합해 매매 신호를 도출한다. (4) 리스크 관리 팀(Risk Management Team)은 공격적(aggressive)·중립(neutral)·보수(conservative) 세 관점이 토론해 노출을 조정한다. (5) 펀드 매니저(Fund Manager)가 최종 승인·집행한다. 에이전트 간 통신은 '구조화 리포트'를 1차 채널로, '자연어 대화'를 2차 채널로 쓰는 하이브리드 방식이며, 공유 글로벌 에이전트 상태(global agent state)와 메모리로 과거 결정 맥락을 유지한다(명시적 reflection 모듈 여부는 본문 확인 필요). 모델은 2계층(two-tier) 전략으로, 추론 집약 노드(분석·연구·트레이딩)에는 심층사고(deep-thinking) o1-preview를, 요약·데이터 변환·검색 등에는 신속사고(quick-thinking) gpt-4o/gpt-4o-mini를 배정하고, 전 에이전트는 ReAct 프롬프팅 프레임워크를 따른다(논문 명시). LangGraph는 논문 본문이 아니라 공식 오픈소스 레포/문서에서 구현 스택으로 명시된다('built with LangGraph').",
        "experiment_setup": [
          "대상 종목: AAPL, GOOGL, AMZN (3종목 소규모 표본)",
          "백테스트 기간: 2024-06-19 ~ 2024-11-19 (약 5개월) — 원문(arXiv v1) 확인. 초안의 '2024년 1~3월/88거래일'은 오류로 정정",
          "비교군(baselines): Buy & Hold(B&H), MACD, KDJ&RSI, ZMR, SMA 등 규칙기반 전략 (강한 ML/RL 트레이딩 비교군은 없음)",
          "평가지표: 누적수익률(CR), 연환산수익률(ARR), 샤프비율(SR), 최대낙폭(MDD)",
          "핵심 결과(Table 1, 원문 대조 일치): AAPL CR 26.62% / ARR 30.5% / SR 8.21 / MDD 0.91%",
          "GOOGL CR 24.36% / ARR 27.58% / SR 6.39 / MDD 1.69%; AMZN CR 23.21% / ARR 24.90% / SR 5.60 / MDD 2.11%",
          "원문 명시 개선폭(최고 베이스라인 대비): AAPL 누적 +24.57%·연환산 +28.43%, GOOGL +16.58%/+19.49%, AMZN +6.10%/+7.30% (SR 개선폭은 원문 미제시)",
          "거래비용·슬리피지·세금 가정은 본문에서 언급 확인 안 됨"
        ],
        "datasets": [
          {
            "name": "과거 주가 시계열(OHLCV)",
            "scale": "3종목 × 약 5개월(2024-06-19~11-19), Yahoo Finance/EODHD 등",
            "domain": "시장 가격 데이터"
          },
          {
            "name": "뉴스 기사",
            "scale": "Bloomberg, Yahoo, EODHD, FinnHub 등 다중 소스",
            "domain": "금융 뉴스/거시 지표"
          },
          {
            "name": "소셜미디어 감성",
            "scale": "Reddit, X/Twitter 게시물 + 보조 LM 감성 점수",
            "domain": "시장 심리"
          },
          {
            "name": "내부자·재무 데이터",
            "scale": "SEDI 인사이더 거래, 기업 공시·재무제표",
            "domain": "펀더멘털"
          },
          {
            "name": "기술적 지표",
            "scale": "60개 표준 기술분석 지표(MACD, RSI, Bollinger Bands 등) — 원문 'sixty ... indicators'",
            "domain": "기술적 분석"
          }
        ],
        "limitations": {
          "by_authors": [
            "과거 데이터 백테스트에 한정되며 실거래(live trading) 배포는 미검증 — 향후 과제로 명시",
            "데이터 가용성 의존: 데이터 부재가 실제 거래 부재를 의미할 수 있어 신호 누락 가능",
            "테스트 종목 수가 3개(AAPL/GOOGL/AMZN)로 소규모",
            "다라운드 토론에 따른 지연·API 크레딧 비용 등 운영 오버헤드 존재"
          ],
          "by_claude": [
            "보고된 샤프비율(AAPL SR 8.21 등)이 실무 기준으로 비현실적으로 높음 — 약 5개월의 짧고 대체로 우호적이었던 대형 기술주 구간과 3종목 소표본에 기인한 과대추정 가능성",
            "거래비용·슬리피지·세금 반영 여부가 본문에서 확인되지 않음 — 미반영 시 실현 성과는 크게 하락 가능",
            "베이스라인이 B&H·규칙기반 위주라 강한 ML/RL 트레이딩 비교군이 부재해 우위 주장의 상대적 강도가 제한적",
            "데이터 누출 통제 서술이 불명확 — 백테스트 구간(2024 하반기)은 사용 모델(gpt-4o/o1-preview, 학습 컷오프 ~2023) 이후라 단순 암기형 누출 위험은 낮은 편이나, 뉴스·검색 파이프라인의 시점정합(point-in-time) 통제(미래 기사·미래 지표 유입 차단) 여부는 본문 확인 필요",
            "원문이 제시한 개선폭은 CR/ARR 기준이며 SR 개선폭은 없음 — 초안의 'SR +6.57 우위'는 원문 근거 없어 삭제함"
          ]
        },
        "reproducibility": {
          "code": "공개 (github.com/TauricResearch/TradingAgents, Python, CLI+패키지, 조회 시점 약 94.6k 스타 — 변동값)",
          "weights": "해당 없음 — 자체 학습 가중치 없이 OpenAI/Anthropic/Google/xAI/DeepSeek/Qwen/Ollama 등 상용·로컬 LLM API를 호출하는 구조",
          "data": "부분 공개 — Yahoo/FinnHub/EODHD/Reddit 등 공개 API로 수집(API 키 필요), 정제·전처리 세부는 재현 시 재구성 필요",
          "license": "Apache-2.0 (레포 확인)",
          "note": "코드는 완전 공개이며 레포/문서에 LangGraph 기반 구현, 다중 LLM 프로바이더·Ollama 로컬 모델, CLI가 명시됨. 상용 LLM API 키가 필요해 비용·모델 버전에 따라 결과 재현이 달라질 수 있고, 레포에 '연구 목적이며 금융/투자/트레이딩 조언 아님' 면책이 명시됨. 논문 성과 수치(Table 1)는 원문과 1:1 대조해 일치 확인함."
        },
        "my_learning_points": [
          "역할 분리 + 하이브리드 통신 패턴을 직접 모사해볼 것: 구조화 리포트(1차)와 자연어 토론(2차)을 상태 그래프(예: LangGraph)로 분리하면 '데이터 수집 → 관점 토론 → 리스크 조정 → 승인/집행' 파이프라인을 재사용 가능한 템플릿으로 만들 수 있다.",
          "2계층 모델 라우팅(deep-thinking o1-preview vs quick-thinking gpt-4o/mini)을 벤치마크할 것: 추론 노드에만 고비용 모델을 쓰고 요약·검색은 저비용 모델로 돌려 비용/성능 트레이드오프를 직접 측정하면 실전 에이전트 설계 감각을 얻는다.",
          "화려한 수익률(SR 8.21)을 액면 그대로 믿지 말고 재현 실험을 설계할 것: 종목·기간을 넓히고 거래비용을 넣은 뒤, 특히 뉴스/지표 검색을 시점정합(point-in-time)으로 잠근 out-of-sample 백테스트를 돌려 미래정보 유입을 통제하는 검증 습관을 기른다."
        ],
        "related_work": {
          "prior": [
            {
              "name": "ReAct (Yao et al., 2022)",
              "relation": "전 에이전트의 추론-행동 결합 프롬프팅 기반으로 채택(논문 명시)"
            },
            {
              "name": "Generative Agents (Park et al., 2023)",
              "relation": "LLM 에이전트 사회/역할 시뮬레이션이라는 설계 철학의 선행"
            },
            {